{"lines":[{"id":"jr-east:keihin-tohoku","nameEn":"Keihin-Tohoku-Negishi Line","nameJa":"京浜東北線・根岸線","operatorId":"jr-east"}],"metadata":{"datasetVersion":"jr-east:2610:868ee8fb330249aa","generatedAt":"2026-09-27T10:23:38.694Z","manifestHash":"868ee8fb330249aa4c312117d569c166bbb006745653a62adcb8da448ab044e2","operator":"jr-east","parserVersion":"jr-east-matrix/2.0.0+jr-east-train-detail/1.0.0","sourceArtifactHashes":["1f3e6c0802eee58ca3528f1e1d6e5e41c76a0d8a024686b94896531111164a43","330998788b5f0201f6a59fb65131f080b86439b07596ece08b7e7313854a61c0","4c559409860a03db377651186c37ccf26ce331f4c71c4979096bd4adedbb3dc2","555882890ab345aa9d04f2d8229fe3e2d661393bbf0b17469af92f558dd1ab1d","bc67e64d5924558d0db34b9414aabb74143f4e0c06d085e7a17e8ab9e119a497"],"timetableEdition":"2610"},"operators":[{"id":"jr-east","nameEn":"JR East","nameJa":"東日本旅客鉄道"}],"schemaVersion":"1.0","serviceCalendars":[{"calendarConfidence":"explicit-page-label","endDate":"2026-12-31","exceptions":[],"friday":true,"id":"jr-east:keihin-tohoku:weekday","monday":true,"saturday":false,"sourceReferences":[{"artifactSha256":"1f3e6c0802eee58ca3528f1e1d6e5e41c76a0d8a024686b94896531111164a43","sourceEdition":"2610","sourceType":"keihin-tohoku-matrix-html","sourceUrl":"https://timetables.jreast.co.jp/2610/timetable-v/623d1.html"}],"startDate":"2026-09-18","sunday":false,"thursday":true,"tuesday":true,"unresolvedCalendarConditions":["Public-holiday weekday exceptions and temporary suspensions are not inferred in this PoC."],"wednesday":true}],"stations":[{"id":"jr-east:大宮","nameJa":"大宮","operatorId":"jr-east"},{"id":"jr-east:さいたま新都心","nameJa":"さいたま新都心","operatorId":"jr-east"},{"id":"jr-east:与野","nameJa":"与野","operatorId":"jr-east"},{"id":"jr-east:北浦和","nameJa":"北浦和","operatorId":"jr-east"},{"id":"jr-east:浦和","nameJa":"浦和","operatorId":"jr-east"},{"id":"jr-east:南浦和","nameJa":"南浦和","operatorId":"jr-east"},{"id":"jr-east:蕨","nameJa":"蕨","operatorId":"jr-east"},{"id":"jr-east:西川口","nameJa":"西川口","operatorId":"jr-east"},{"id":"jr-east:川口","nameJa":"川口","operatorId":"jr-east"},{"id":"jr-east:赤羽","nameJa":"赤羽","operatorId":"jr-east"},{"id":"jr-east:東十条","nameJa":"東十条","operatorId":"jr-east"},{"id":"jr-east:王子","nameJa":"王子","operatorId":"jr-east"},{"id":"jr-east:上中里","nameJa":"上中里","operatorId":"jr-east"},{"id":"jr-east:田端","nameJa":"田端","operatorId":"jr-east"},{"id":"jr-east:西日暮里","nameJa":"西日暮里","operatorId":"jr-east"},{"id":"jr-east:日暮里","nameJa":"日暮里","operatorId":"jr-east"},{"id":"jr-east:鶯谷","nameJa":"鶯谷","operatorId":"jr-east"},{"id":"jr-east:上野","nameJa":"上野","operatorId":"jr-east"},{"id":"jr-east:御徒町","nameJa":"御徒町","operatorId":"jr-east"},{"id":"jr-east:秋葉原","nameJa":"秋葉原","operatorId":"jr-east"},{"id":"jr-east:神田","nameJa":"神田","operatorId":"jr-east"},{"id":"jr-east:東京","nameJa":"東京","operatorId":"jr-east"},{"id":"jr-east:有楽町","nameJa":"有楽町","operatorId":"jr-east"},{"id":"jr-east:新橋","nameJa":"新橋","operatorId":"jr-east"},{"id":"jr-east:浜松町","nameJa":"浜松町","operatorId":"jr-east"},{"id":"jr-east:田町","nameJa":"田町","operatorId":"jr-east"},{"id":"jr-east:高輪ゲートウェイ","nameJa":"高輪ゲートウェイ","operatorId":"jr-east"},{"id":"jr-east:品川","nameJa":"品川","operatorId":"jr-east"},{"id":"jr-east:大井町","nameJa":"大井町","operatorId":"jr-east"},{"id":"jr-east:大森","nameJa":"大森","operatorId":"jr-east"},{"id":"jr-east:蒲田","nameJa":"蒲田","operatorId":"jr-east"},{"id":"jr-east:東神奈川","nameJa":"東神奈川","operatorId":"jr-east"},{"id":"jr-east:横浜","nameJa":"横浜","operatorId":"jr-east"},{"id":"jr-east:桜木町","nameJa":"桜木町","operatorId":"jr-east"},{"id":"jr-east:関内","nameJa":"関内","operatorId":"jr-east"},{"id":"jr-east:石川町","nameJa":"石川町","operatorId":"jr-east"},{"id":"jr-east:山手","nameJa":"山手","operatorId":"jr-east"},{"id":"jr-east:根岸","nameJa":"根岸","operatorId":"jr-east"},{"id":"jr-east:磯子","nameJa":"磯子","operatorId":"jr-east"},{"id":"jr-east:新杉田","nameJa":"新杉田","operatorId":"jr-east"},{"id":"jr-east:洋光台","nameJa":"洋光台","operatorId":"jr-east"},{"id":"jr-east:港南台","nameJa":"港南台","operatorId":"jr-east"},{"id":"jr-east:本郷台","nameJa":"本郷台","operatorId":"jr-east"},{"id":"jr-east:大船","nameJa":"大船","operatorId":"jr-east"}],"trips":[{"destinationStationId":"jr-east:蒲田","direction":"southbound","internalTripId":"jr-east:2610:keihin-tohoku:southbound:903a:大宮:09-01-00:weekday-102","lineId":"jr-east:keihin-tohoku","operationConditions":["平日"],"operator":"jr-east","originStationId":"jr-east:大宮","serviceId":"jr-east:keihin-tohoku:weekday","sourceEdition":"2610","sourceReference":{"artifactSha256":"1f3e6c0802eee58ca3528f1e1d6e5e41c76a0d8a024686b94896531111164a43","sourceEdition":"2610","sourceType":"keihin-tohoku-matrix-html","sourceUrl":"https://timetables.jreast.co.jp/2610/timetable-v/623d1.html","sourceUrlKey":"623d1.html"},"sourceUrl":"https://timetables.jreast.co.jp/2610/timetable-v/623d1.html","stopTimes":[{"departure":{"dayOffset":0,"hour":9,"minute":1,"second":0},"passThrough":false,"sequence":0,"sourceReference":{"artifactSha256":"1f3e6c0802eee58ca3528f1e1d6e5e41c76a0d8a024686b94896531111164a43","sourceEdition":"2610","sourceType":"keihin-tohoku-matrix-html","sourceUrl":"https://timetables.jreast.co.jp/2610/timetable-v/623d1.html","sourceUrlKey":"623d1.html"},"stationId":"jr-east:大宮"},{"departure":{"dayOffset":0,"hour":9,"minute":3,"second":0},"passThrough":false,"sequence":1,"sourceReference":{"artifactSha256":"1f3e6c0802eee58ca3528f1e1d6e5e41c76a0d8a024686b94896531111164a43","sourceEdition":"2610","sourceType":"keihin-tohoku-matrix-html","sourceUrl":"https://timetables.jreast.co.jp/2610/timetable-v/623d1.html","sourceUrlKey":"623d1.html"},"stationId":"jr-east:さいたま新都心"},{"departure":{"dayOffset":0,"hour":9,"minute":5,"second":0},"passThrough":false,"sequence":2,"sourceReference":{"artifactSha256":"1f3e6c0802eee58ca3528f1e1d6e5e41c76a0d8a024686b94896531111164a43","sourceEdition":"2610","sourceType":"keihin-tohoku-matrix-html","sourceUrl":"https://timetables.jreast.co.jp/2610/timetable-v/623d1.html","sourceUrlKey":"623d1.html"},"stationId":"jr-east:与野"},{"departure":{"dayOffset":0,"hour":9,"minute":8,"second":0},"passThrough":false,"sequence":3,"sourceReference":{"artifactSha256":"1f3e6c0802eee58ca3528f1e1d6e5e41c76a0d8a024686b94896531111164a43","sourceEdition":"2610","sourceType":"keihin-tohoku-matrix-html","sourceUrl":"https://timetables.jreast.co.jp/2610/timetable-v/623d1.html","sourceUrlKey":"623d1.html"},"stationId":"jr-east:北浦和"},{"departure":{"dayOffset":0,"hour":9,"minute":10,"second":0},"passThrough":false,"sequence":4,"sourceReference":{"artifactSha256":"1f3e6c0802eee58ca3528f1e1d6e5e41c76a0d8a024686b94896531111164a43","sourceEdition":"2610","sourceType":"keihin-tohoku-matrix-html","sourceUrl":"https://timetables.jreast.co.jp/2610/timetable-v/623d1.html","sourceUrlKey":"623d1.html"},"stationId":"jr-east:浦和"},{"departure":{"dayOffset":0,"hour":9,"minute":13,"second":0},"passThrough":false,"sequence":5,"sourceReference":{"artifactSha256":"1f3e6c0802eee58ca3528f1e1d6e5e41c76a0d8a024686b94896531111164a43","sourceEdition":"2610","sourceType":"keihin-tohoku-matrix-html","sourceUrl":"https://timetables.jreast.co.jp/2610/timetable-v/623d1.html","sourceUrlKey":"623d1.html"},"stationId":"jr-east:南浦和"},{"departure":{"dayOffset":0,"hour":9,"minute":17,"second":0},"passThrough":false,"sequence":6,"sourceReference":{"artifactSha256":"1f3e6c0802eee58ca3528f1e1d6e5e41c76a0d8a024686b94896531111164a43","sourceEdition":"2610","sourceType":"keihin-tohoku-matrix-html","sourceUrl":"https://timetables.jreast.co.jp/2610/timetable-v/623d1.html","sourceUrlKey":"623d1.html"},"stationId":"jr-east:蕨"},{"departure":{"dayOffset":0,"hour":9,"minute":19,"second":0},"passThrough":false,"sequence":7,"sourceReference":{"artifactSha256":"1f3e6c0802eee58ca3528f1e1d6e5e41c76a0d8a024686b94896531111164a43","sourceEdition":"2610","sourceType":"keihin-tohoku-matrix-html","sourceUrl":"https://timetables.jreast.co.jp/2610/timetable-v/623d1.html","sourceUrlKey":"623d1.html"},"stationId":"jr-east:西川口"},{"departure":{"dayOffset":0,"hour":9,"minute":22,"second":0},"passThrough":false,"sequence":8,"sourceReference":{"artifactSha256":"1f3e6c0802eee58ca3528f1e1d6e5e41c76a0d8a024686b94896531111164a43","sourceEdition":"2610","sourceType":"keihin-tohoku-matrix-html","sourceUrl":"https://timetables.jreast.co.jp/2610/timetable-v/623d1.html","sourceUrlKey":"623d1.html"},"stationId":"jr-east:川口"},{"departure":{"dayOffset":0,"hour":9,"minute":25,"second":0},"passThrough":false,"sequence":9,"sourceReference":{"artifactSha256":"1f3e6c0802eee58ca3528f1e1d6e5e41c76a0d8a024686b94896531111164a43","sourceEdition":"2610","sourceType":"keihin-tohoku-matrix-html","sourceUrl":"https://timetables.jreast.co.jp/2610/timetable-v/623d1.html","sourceUrlKey":"623d1.html"},"stationId":"jr-east:赤羽"},{"departure":{"dayOffset":0,"hour":9,"minute":28,"second":0},"passThrough":false,"sequence":10,"sourceReference":{"artifactSha256":"1f3e6c0802eee58ca3528f1e1d6e5e41c76a0d8a024686b94896531111164a43","sourceEdition":"2610","sourceType":"keihin-tohoku-matrix-html","sourceUrl":"https://timetables.jreast.co.jp/2610/timetable-v/623d1.html","sourceUrlKey":"623d1.html"},"stationId":"jr-east:東十条"},{"departure":{"dayOffset":0,"hour":9,"minute":30,"second":0},"passThrough":false,"sequence":11,"sourceReference":{"artifactSha256":"1f3e6c0802eee58ca3528f1e1d6e5e41c76a0d8a024686b94896531111164a43","sourceEdition":"2610","sourceType":"keihin-tohoku-matrix-html","sourceUrl":"https://timetables.jreast.co.jp/2610/timetable-v/623d1.html","sourceUrlKey":"623d1.html"},"stationId":"jr-east:王子"},{"departure":{"dayOffset":0,"hour":9,"minute":32,"second":0},"passThrough":false,"sequence":12,"sourceReference":{"artifactSha256":"1f3e6c0802eee58ca3528f1e1d6e5e41c76a0d8a024686b94896531111164a43","sourceEdition":"2610","sourceType":"keihin-tohoku-matrix-html","sourceUrl":"https://timetables.jreast.co.jp/2610/timetable-v/623d1.html","sourceUrlKey":"623d1.html"},"stationId":"jr-east:上中里"},{"departure":{"dayOffset":0,"hour":9,"minute":35,"second":0},"passThrough":false,"sequence":13,"sourceReference":{"artifactSha